{
  "brief_id": "d33d5d7c58e50b16",
  "generated_at": "2026-10-27T09:00:00Z",
  "source_mode": "fixtures",
  "fixture": true,
  "address": {
    "display": "W Idaho St, Boise, ID 83702",
    "lat": 43.6166,
    "lon": -116.2023,
    "state": "ID",
    "county": "Ada",
    "zip": "83702",
    "utility": "Idaho Power"
  },
  "headline": {
    "ai_rent_usd_per_month": 4.0,
    "ai_rent_range_usd_per_month": [
      3.0,
      5.0
    ],
    "percentile": 28,
    "band": "low",
    "one_liner": "Two small facilities within five miles, no construction visible, and a typical home pays about $4 more a month than two years ago."
  },
  "sections": {
    "on_your_grid": {
      "status": "measured",
      "confidence": 0.9,
      "model": null,
      "summary": "Two facilities within five miles, both small colocation sites, both served by Idaho Power like your street.",
      "gap": null,
      "sources": [
        {
          "title": "Facility registry (fictional)",
          "url": "https://example.org/registry/boi-01",
          "retrieved_at": "2026-10-27T09:00:00Z",
          "page": null,
          "quote": ""
        }
      ],
      "facilities": [
        {
          "name": "Capitol Colo",
          "codename": null,
          "operator": "Sawtooth Data (fictional)",
          "operator_confidence": 0.97,
          "distance_km": 0.7,
          "status": "live",
          "estimated_mw": 10,
          "mw_basis": "class_estimate",
          "shares_substation": null,
          "lat": 43.62,
          "lon": -116.21
        },
        {
          "name": "Boise Edge 2",
          "codename": null,
          "operator": "Pinefield Networks (fictional)",
          "operator_confidence": 0.97,
          "distance_km": 4.8,
          "status": "live",
          "estimated_mw": 10,
          "mw_basis": "class_estimate",
          "shares_substation": null,
          "lat": 43.59,
          "lon": -116.25
        }
      ]
    },
    "coming": {
      "status": "measured",
      "confidence": 0.8,
      "model": "sam-3.1",
      "summary": "No new large-roof construction within five miles between the 2023 and 2025 imagery.",
      "gap": null,
      "sources": [
        {
          "title": "USDA aerial imagery 2023 and 2025 (public domain)",
          "url": "https://example.org/naip/ID",
          "retrieved_at": "2026-10-27T09:00:00Z",
          "page": null,
          "quote": ""
        }
      ],
      "construction": []
    },
    "your_bill": {
      "status": "modelled",
      "confidence": 0.8,
      "model": "muse-spark-1.3",
      "summary": "Your state's residential price rose 3.7% over 24 months, about $4 more per month for a typical home.",
      "gap": null,
      "sources": [
        {
          "title": "State residential price series (fictional)",
          "url": "https://example.org/prices/ID",
          "retrieved_at": "2026-10-27T09:00:00Z",
          "page": null,
          "quote": "Average residential price, ID, Aug 2026: 11.2 c/kWh"
        }
      ],
      "price": {
        "currency": "USD",
        "rate_now": 0.112,
        "rate_then": 0.108,
        "trend_pct": 3.7,
        "window_months": 24,
        "typical_household_kwh_month": 1000,
        "attribution": null
      }
    },
    "protection": {
      "status": "reported",
      "confidence": 0.65,
      "model": "muse-spark-1.3",
      "summary": "Partly. A large-load tariff is in force for customers above 20 MW, so new large customers pay their own way onto the grid. The order does not say whether every cost of the build-out stays off household bills.",
      "gap": null,
      "sources": [
        {
          "title": "Commission order (fictional)",
          "url": "https://example.org/puc/order-36000",
          "retrieved_at": "2026-10-27T09:00:00Z",
          "page": 2,
          "quote": "Schedule 20 applies to new loads of 20 MW or more"
        }
      ],
      "tariff": {
        "large_load_tariff": "in_force",
        "name": "Schedule 20 (fictional)",
        "protects_households": true,
        "docket": "IPC-E-26-11"
      }
    },
    "hearing": {
      "status": "unavailable",
      "confidence": 0.0,
      "model": null,
      "summary": "Hearings in this county are not yet indexed.",
      "gap": "Ada County is not in the indexed set. See docs/counties.md.",
      "sources": [],
      "hearing": {
        "next_date": null,
        "body": null
      }
    }
  },
  "claims": [
    {
      "id": "c1",
      "section": "your_bill",
      "text": "The state residential price rose 3.7% over 24 months.",
      "source": {
        "title": "State residential price series (fictional)",
        "url": "https://example.org/prices/ID",
        "retrieved_at": "2026-10-27T09:00:00Z",
        "page": null,
        "quote": "Average residential price, ID, Aug 2026: 11.2 c/kWh"
      },
      "drafted_by": "muse-spark-1.3",
      "verdict": "supported",
      "verified_by": "meta-models/muse-spark-open",
      "verifier_note": null
    },
    {
      "id": "c2",
      "section": "protection",
      "text": "Schedule 20 applies to new loads of 20 MW or more.",
      "source": {
        "title": "Commission order (fictional)",
        "url": "https://example.org/puc/order-36000",
        "retrieved_at": "2026-10-27T09:00:00Z",
        "page": 2,
        "quote": "Schedule 20 applies to new loads of 20 MW or more"
      },
      "drafted_by": "muse-spark-1.3",
      "verdict": "supported",
      "verified_by": "meta-models/muse-spark-open",
      "verifier_note": null
    }
  ],
  "at_your_house": [
    {
      "text": "Your power bill is about $4 a month higher than two years ago, between $3 and $5 depending on usage.",
      "topic": "bill",
      "status": "modelled",
      "confidence": 0.8,
      "sources": [
        {
          "title": "State residential price series (fictional)",
          "url": "https://example.org/prices/ID",
          "retrieved_at": "2026-10-27T09:00:00Z",
          "page": null,
          "quote": "Average residential price, ID, Aug 2026: 11.2 c/kWh"
        }
      ]
    },
    {
      "text": "Two small data centers sit within five miles, the nearest 0.7 miles away. Together they draw about 20 MW, roughly what 15,000 homes use at once.",
      "topic": "grid",
      "status": "measured",
      "confidence": 0.9,
      "sources": [
        {
          "title": "Facility registry (fictional)",
          "url": "https://example.org/registry/boi-01",
          "retrieved_at": "2026-10-27T09:00:00Z",
          "page": null,
          "quote": ""
        }
      ]
    },
    {
      "text": "Nothing new has been built within five miles between the 2023 and 2025 aerial surveys.",
      "topic": "land",
      "status": "measured",
      "confidence": 0.8,
      "sources": [
        {
          "title": "USDA aerial imagery 2023 and 2025 (public domain)",
          "url": "https://example.org/naip/ID",
          "retrieved_at": "2026-10-27T09:00:00Z",
          "page": null,
          "quote": ""
        }
      ]
    }
  ],
  "card": {
    "title": "Who's on my grid: Boise, ID",
    "lines": [
      "2 small facilities within 5 miles, both colocation sites",
      "No new construction visible from the air",
      "About +$4/mo for a typical home vs 2024",
      "Large-load tariff in force"
    ],
    "footer": "Sources: facility registry, aerial imagery, state price series, commission order. Fictional fixture."
  }
}
