{
  "brief_id": "f2afbbd87226c4c8",
  "generated_at": "2026-10-27T09:00:00Z",
  "source_mode": "fixtures",
  "fixture": true,
  "address": {
    "display": "County Rd 12, Faulkton, SD 57438",
    "lat": 45.035,
    "lon": -99.125,
    "state": "SD",
    "county": "Faulk",
    "zip": "57438",
    "utility": "Northern Electric Cooperative"
  },
  "headline": {
    "ai_rent_usd_per_month": 3.2,
    "ai_rent_range_usd_per_month": [
      3.0,
      4.0
    ],
    "percentile": 11,
    "band": "low",
    "one_liner": "No data center within five miles and nothing visible from the air. Your state's price rose about $3 a month for a typical home."
  },
  "sections": {
    "on_your_grid": {
      "status": "measured",
      "confidence": 0.9,
      "model": null,
      "summary": "No data-center facility within five miles.",
      "gap": null,
      "sources": [
        {
          "title": "Facility registry (fictional)",
          "url": "https://example.org/registry/sd",
          "retrieved_at": "2026-10-27T09:00:00Z",
          "page": null,
          "quote": ""
        }
      ],
      "facilities": []
    },
    "coming": {
      "status": "measured",
      "confidence": 0.8,
      "model": "sam-3.1",
      "summary": "No new large-roof construction within five miles between the 2022 and 2024 imagery.",
      "gap": null,
      "sources": [
        {
          "title": "USDA aerial imagery 2022 and 2024 (public domain)",
          "url": "https://example.org/naip/SD",
          "retrieved_at": "2026-10-27T09:00:00Z",
          "page": null,
          "quote": ""
        }
      ],
      "construction": []
    },
    "your_bill": {
      "status": "modelled",
      "confidence": 0.8,
      "model": "muse-spark-1.3",
      "summary": "Your state's residential price rose 2.4% over 24 months, about $3 more per month for a typical home.",
      "gap": null,
      "sources": [
        {
          "title": "State residential price series (fictional)",
          "url": "https://example.org/prices/SD",
          "retrieved_at": "2026-10-27T09:00:00Z",
          "page": null,
          "quote": "Average residential price, SD, Aug 2026: 12.8 c/kWh"
        }
      ],
      "price": {
        "currency": "USD",
        "rate_now": 0.128,
        "rate_then": 0.125,
        "trend_pct": 2.4,
        "window_months": 24,
        "typical_household_kwh_month": 1050,
        "attribution": null
      }
    },
    "protection": {
      "status": "unavailable",
      "confidence": 0.0,
      "model": "muse-spark-1.3",
      "summary": "Not known. No large-load tariff or docket was found for this state, and the absence could not be confirmed.",
      "gap": "Search found no tariff and no docket; the verifier could not confirm a negative.",
      "sources": [],
      "tariff": {
        "large_load_tariff": "unknown",
        "name": null,
        "protects_households": null,
        "docket": null
      }
    },
    "hearing": {
      "status": "unavailable",
      "confidence": 0.0,
      "model": null,
      "summary": "Hearings in this county are not yet indexed.",
      "gap": "Faulk County is not in the indexed set.",
      "sources": [],
      "hearing": {
        "next_date": null,
        "body": null
      }
    }
  },
  "claims": [
    {
      "id": "c1",
      "section": "your_bill",
      "text": "The state residential price rose 2.4% over 24 months.",
      "source": {
        "title": "State residential price series (fictional)",
        "url": "https://example.org/prices/SD",
        "retrieved_at": "2026-10-27T09:00:00Z",
        "page": null,
        "quote": "Average residential price, SD, Aug 2026: 12.8 c/kWh"
      },
      "drafted_by": "muse-spark-1.3",
      "verdict": "supported",
      "verified_by": "meta-models/muse-spark-open",
      "verifier_note": null
    }
  ],
  "at_your_house": [
    {
      "text": "Your power bill is about $3 a month higher than two years ago, between $3 and $4 depending on usage.",
      "topic": "bill",
      "status": "modelled",
      "confidence": 0.8,
      "sources": [
        {
          "title": "State residential price series (fictional)",
          "url": "https://example.org/prices/SD",
          "retrieved_at": "2026-10-27T09:00:00Z",
          "page": null,
          "quote": "Average residential price, SD, Aug 2026: 12.8 c/kWh"
        }
      ]
    },
    {
      "text": "There is no data center within five miles of you, and nothing new has been built from the air.",
      "topic": "grid",
      "status": "measured",
      "confidence": 0.9,
      "sources": [
        {
          "title": "Facility registry (fictional)",
          "url": "https://example.org/registry/sd",
          "retrieved_at": "2026-10-27T09:00:00Z",
          "page": null,
          "quote": ""
        },
        {
          "title": "USDA aerial imagery 2022 and 2024 (public domain)",
          "url": "https://example.org/naip/SD",
          "retrieved_at": "2026-10-27T09:00:00Z",
          "page": null,
          "quote": ""
        }
      ]
    }
  ],
  "card": {
    "title": "Who's on my grid: Faulkton, SD",
    "lines": [
      "Nothing within 5 miles",
      "Nothing new visible from the air",
      "About +$3/mo for a typical home vs 2024",
      "Tariff protection: not known"
    ],
    "footer": "Sources: facility registry, aerial imagery, state price series. Fictional fixture."
  }
}
